{
  "schema_version": "1.4",
  "sent_at": 1760551300.104,
  "units": { "t": "s", "sent_at": "unix s", "rpm": "rev/min", "load_pct": "%", "latency_ms": "ms", "severity": "0-1", "crank_deg": "deg" },
  "run_id": "real_p3_0003",
  "source": "real",
  "audioset_pool": "P3",
  "engine_tag": "vetted_car",
  "mode": "replay",
  "t": 4.0,
  "operating_point": { "rpm": null, "load_pct": null, "regime": "idle" },
  "localisation": "none",
  "features_summary": { "knock_band_ratio": 0.9, "kurtosis": 3.2 },
  "anomaly": { "score": 0.21, "threshold": 0.60, "per_location": [] },
  "models": [
    { "model": "SVM", "label": "healthy", "p": 0.93 },
    { "model": "ANN", "label": "healthy", "p": 0.91 },
    { "model": "CNN", "label": "healthy", "p": 0.89 }
  ],
  "physics_rules": [ { "rule": "knock", "fired": false, "location": null, "rule_basis": "firing_event" } ],
  "decision": {
    "state": "NORMAL",
    "alarm_id": null,
    "fault": null, "location": null, "severity": null,
    "witnesses": [], "consecutive_windows": 0,
    "latched": false, "acked": false, "acked_by": null, "acked_at": null
  },
  "health": { "asset_ne107": "NORMAL", "sensors": { "mic": "NORMAL" } },
  "latency_ms": 38,
  "signature": { "crank_deg": [], "amplitude": [], "baseline_amplitude": [] },
  "injection": null
}
